id,fecha,usuario,avatar_color,juego,titulo,mensaje,likes,respuestas
1,2024-05-21,CyberNinja,#00d2ff,Cyberpunk 2077,Build de Netrunner,"He encontrado una build rota con el monocable. ¿Alguien la ha probado en la actualización 2.1?",45,12
2,2024-05-20,EldenLord,#e94560,Elden Ring,Malenia es imposible,"Llevo 45 intentos. ¿Algún consejo para esquivar el Waterfowl Dance sin usar escudo?",120,34
3,2024-05-19,RetroGamer,#adff02,Super Mario 64,El pingüino,"Admitid que todos habéis tirado al pingüino por el precipicio alguna vez.",890,56
4,2024-05-18,KratosFan,#ff8e00,God of War,Teoría sobre Atreus,"Tengo una teoría loca sobre el final del juego y la mitología nórdica...",23,5
5,2024-05-17,SpeedRunner,#b500ff,Hollow Knight,Path of Pain,"Acabo de completar el Path of Pain en 5 minutos. Aquí está el clip.",67,8
